{
  "schema": "yuruna.catalog/v1",
  "domain": "auth",
  "locale": "en-US",
  "messages": {
    "auth.attempts_throttled": {
      "message": "too many attempts; wait {minutes} minutes and try again",
      "description": "Shared service authorization refusal or verifier diagnostic shown to the operator.",
      "lifecycle": "active",
      "placeholders": {
        "minutes": {
          "type": "integer",
          "trust": "internal",
          "example": 10
        }
      }
    },
    "auth.bearer_required": {
      "message": "lab auth token required",
      "description": "Shared service authorization refusal or verifier diagnostic shown to the operator.",
      "lifecycle": "active"
    },
    "auth.changes_disabled": {
      "message": "no aggregator URL and no lab auth token configured; changes are disabled",
      "description": "Shared service authorization refusal or verifier diagnostic shown to the operator.",
      "lifecycle": "active"
    },
    "auth.detail_encoding": {
      "message": "request encoding failed",
      "description": "Shared service authorization refusal or verifier diagnostic shown to the operator.",
      "lifecycle": "active"
    },
    "auth.detail_http": {
      "message": "aggregator answered HTTP {status}",
      "description": "Shared service authorization refusal or verifier diagnostic shown to the operator.",
      "lifecycle": "active",
      "placeholders": {
        "status": {
          "type": "integer",
          "trust": "internal",
          "example": 503
        }
      }
    },
    "auth.detail_malformed_aggregator": {
      "message": "malformed aggregator URL",
      "description": "Shared service authorization refusal or verifier diagnostic shown to the operator.",
      "lifecycle": "active"
    },
    "auth.detail_no_aggregator": {
      "message": "no aggregator URL configured",
      "description": "Shared service authorization refusal or verifier diagnostic shown to the operator.",
      "lifecycle": "active"
    },
    "auth.detail_unconfigured": {
      "message": "no lab auth token and no aggregator URL configured",
      "description": "Shared service authorization refusal or verifier diagnostic shown to the operator.",
      "lifecycle": "active"
    },
    "auth.detail_unreachable": {
      "message": "unreachable",
      "description": "Shared service authorization refusal or verifier diagnostic shown to the operator.",
      "lifecycle": "active"
    },
    "auth.encode_refusal": {
      "message": "the gate could not encode its refusal",
      "description": "Shared service authorization refusal or verifier diagnostic shown to the operator.",
      "lifecycle": "active"
    },
    "auth.login_unavailable": {
      "message": "no aggregator URL is configured, so the pool aggregator cannot check a lab token; actions stay locked",
      "description": "Shared service authorization refusal or verifier diagnostic shown to the operator.",
      "lifecycle": "active"
    },
    "auth.malformed_request": {
      "message": "malformed request body",
      "description": "Shared service authorization refusal or verifier diagnostic shown to the operator.",
      "lifecycle": "active"
    },
    "auth.proof_check_failed": {
      "message": "the control proof could not be checked ({detail}); actions stay locked",
      "description": "Shared service authorization refusal or verifier diagnostic shown to the operator.",
      "lifecycle": "active",
      "placeholders": {
        "detail": {
          "type": "detail",
          "trust": "external",
          "example": "unreachable"
        }
      }
    },
    "auth.proof_expired": {
      "message": "the control proof is expired or not from this pool",
      "description": "Shared service authorization refusal or verifier diagnostic shown to the operator.",
      "lifecycle": "active"
    },
    "auth.proof_shape": {
      "message": "not a control proof",
      "description": "Shared service authorization refusal or verifier diagnostic shown to the operator.",
      "lifecycle": "active"
    },
    "auth.proof_unconfigured": {
      "message": "no lab auth token and no aggregator URL are configured, so a control proof cannot be checked; actions stay locked",
      "description": "Shared service authorization refusal or verifier diagnostic shown to the operator.",
      "lifecycle": "active"
    },
    "auth.refresh_credential_required": {
      "message": "This action requires the refresh credential in the X-Yuruna-Refresh-Credential header; a lab session, lab token or internal authentication key is not accepted.",
      "description": "Refusal from the host refresh credential gate when the request does not carry the operator refresh credential in its dedicated header; returned as HTTP 401 or as an MCP refusal. Preserve the header name X-Yuruna-Refresh-Credential exactly.",
      "lifecycle": "active"
    },
    "auth.refresh_throttled": {
      "message": "Too many refresh credential attempts from this address; wait {minutes} minutes and try again.",
      "description": "Refusal from the host refresh credential gate (extension-sdk hostrefresh gate) after repeated wrong credentials from one source address; returned as HTTP 429 or as an MCP refusal.",
      "lifecycle": "active",
      "placeholders": {
        "minutes": {
          "type": "integer",
          "trust": "internal",
          "example": "10"
        }
      }
    },
    "auth.refresh_unconfigured": {
      "message": "Remote host refresh is disabled: this service has no refresh credential provisioned.",
      "description": "Refusal from the host refresh credential gate (extension-sdk hostrefresh gate) when the service holds no operator refresh credential; returned as HTTP 503 or as an MCP refusal. The credential and header names are protocol terms; keep them.",
      "lifecycle": "active"
    },
    "auth.route_disabled": {
      "message": "no lab auth token configured; this route is disabled",
      "description": "Shared service authorization refusal or verifier diagnostic shown to the operator.",
      "lifecycle": "active"
    },
    "auth.session_required": {
      "message": "lab token session or lab auth token required",
      "description": "Shared service authorization refusal or verifier diagnostic shown to the operator.",
      "lifecycle": "active"
    },
    "auth.token_check_failed": {
      "message": "the pool aggregator could not check the lab token ({detail}); actions stay locked",
      "description": "Shared service authorization refusal or verifier diagnostic shown to the operator.",
      "lifecycle": "active",
      "placeholders": {
        "detail": {
          "type": "detail",
          "trust": "external",
          "example": "unreachable"
        }
      }
    },
    "auth.token_incorrect": {
      "message": "incorrect lab token",
      "description": "Shared service authorization refusal or verifier diagnostic shown to the operator.",
      "lifecycle": "active"
    },
    "auth.token_shape": {
      "message": "the lab token is the 6-character code on the dashboard's Lab token tile",
      "description": "Shared service authorization refusal or verifier diagnostic shown to the operator.",
      "lifecycle": "active"
    }
  }
}
