{
  "schema": "yuruna.catalog/v1",
  "domain": "auth",
  "locale": "zh-CN",
  "messages": {
    "auth.attempts_throttled": {
      "sourceHash": "009d46589d10f1a10e312d188f68420f4e8a20e97ff02a4945eda697646d3ee9",
      "origin": "machine",
      "message": "尝试次数过多；请等待{minutes}分钟后重试"
    },
    "auth.bearer_required": {
      "sourceHash": "e269e54552e20e8c83c9eecbf098e5ba43baf1754f722c4da50f2fe759b9c883",
      "origin": "machine",
      "message": "需要实验室身份验证令牌"
    },
    "auth.changes_disabled": {
      "sourceHash": "adf30329cd713ee8b9dc06d3c3e91d1e1dbcfb220ba164a324b8b154dc86e13f",
      "origin": "machine",
      "message": "未配置聚合器URL和实验室身份验证令牌；已禁用更改"
    },
    "auth.detail_encoding": {
      "sourceHash": "a4efa59696a4263b5fabc4e4da0a8fe1e4bca45492968cb1695d61a0cfe65e32",
      "origin": "machine",
      "message": "请求编码失败"
    },
    "auth.detail_http": {
      "sourceHash": "c499c5d43b4bb3bbb48d1bce4566aefcb3b1d41f970ef096e418e1e1030c667a",
      "origin": "machine",
      "message": "聚合器返回HTTP {status}"
    },
    "auth.detail_malformed_aggregator": {
      "sourceHash": "e8d1791302887cf89033cc2a919165df7fbc63bfacda515eda4ea794a455bd15",
      "origin": "machine",
      "message": "聚合器URL格式错误"
    },
    "auth.detail_no_aggregator": {
      "sourceHash": "9d3d90ce612546f8f1a5cbebd2c64803d1b31c401e0ad1c2499be8dc7be4d46c",
      "origin": "machine",
      "message": "未配置聚合器URL"
    },
    "auth.detail_unconfigured": {
      "sourceHash": "beb2fc6d77adef12ac27525848323c85dba1e5f3efcf8fefcc96caeff1ea9b10",
      "origin": "machine",
      "message": "未配置实验室身份验证令牌和聚合器URL"
    },
    "auth.detail_unreachable": {
      "sourceHash": "36cd45ae1bf97f882050783f2730fe54100642d7611c1cc77a57c44ece74516e",
      "origin": "machine",
      "message": "无法访问"
    },
    "auth.encode_refusal": {
      "sourceHash": "f34c2c0d1fb707438efe2bdf852e564750fecfe99d97326b36f33075360fd718",
      "origin": "machine",
      "message": "授权关卡无法对拒绝响应进行编码"
    },
    "auth.login_unavailable": {
      "sourceHash": "ddb9a5ccf34e26bfb6fd9bfcefe789b916ca22c2a574e38f5d5d9801d2219e1b",
      "origin": "machine",
      "message": "未配置聚合器URL，因此池聚合器无法验证实验室令牌；操作保持锁定"
    },
    "auth.malformed_request": {
      "sourceHash": "bec17e6df0e7060ee6f3d5c5462959519c509b3abf10f3ef8af4f19268765d3c",
      "origin": "machine",
      "message": "请求正文格式错误"
    },
    "auth.proof_check_failed": {
      "sourceHash": "4b6283c1633f4cec4b49fda6d7a2582d4fa28c2b71335969b50dae64539965a1",
      "origin": "machine",
      "message": "无法验证控制证明（{detail}）；操作保持锁定"
    },
    "auth.proof_expired": {
      "sourceHash": "f7df3e54e1569b75630f9837a3f3af893f5ec736342f25df175c67c3881a4bb4",
      "origin": "machine",
      "message": "控制证明已过期或并非来自此池"
    },
    "auth.proof_shape": {
      "sourceHash": "d38e76d096809582168fa47481773cc99e7585ab179cefa7ca7be27732449b2d",
      "origin": "machine",
      "message": "不是控制证明"
    },
    "auth.proof_unconfigured": {
      "sourceHash": "12bdaa8ced579ad72a209b071b073673aaeb5fe1972e655d19c11911cf7553ad",
      "origin": "machine",
      "message": "未配置实验室身份验证令牌和聚合器URL，因此无法验证控制证明；操作保持锁定"
    },
    "auth.refresh_credential_required": {
      "sourceHash": "e061a6b4e0db654a4215ea8c81e83cb40e2722449759c03b5d55d837261d80ef",
      "origin": "machine",
      "message": "此操作需要在X-Yuruna-Refresh-Credential请求头中提供刷新凭据；不接受实验室会话、实验室令牌或内部身份验证密钥。"
    },
    "auth.refresh_throttled": {
      "sourceHash": "a6301a335b855f6db2107ff013261949929f8220ab069827070555ab9b90ebe8",
      "origin": "machine",
      "message": "来自此地址的刷新凭据尝试次数过多；请等待{minutes}分钟后重试。"
    },
    "auth.refresh_unconfigured": {
      "sourceHash": "54023b1a0dde6c873d530a7c2d783582f772877a39d663898933e8a7b9612dd3",
      "origin": "machine",
      "message": "远程宿主机刷新已禁用：此服务未配置刷新凭据。"
    },
    "auth.route_disabled": {
      "sourceHash": "5e056810e1f98a51aa46ef4a2cbd14f004bab6afafcddc34d8b07d0322f7d3aa",
      "origin": "machine",
      "message": "未配置实验室身份验证令牌；此路由已禁用"
    },
    "auth.session_required": {
      "sourceHash": "2f1b82e7d2cb0caa8fbc4d70e02b4ee7cdb825850f7abf5e5d7ad05bb618270d",
      "origin": "machine",
      "message": "需要实验室令牌会话或实验室身份验证令牌"
    },
    "auth.token_check_failed": {
      "sourceHash": "0938c3c0036c09ea1cc9cdf7b94a6cf21f556cae465682c1b574561bbc8ec278",
      "origin": "machine",
      "message": "池聚合器无法验证实验室令牌（{detail}）；操作保持锁定"
    },
    "auth.token_incorrect": {
      "sourceHash": "ddf52fd6652e7659905a5c8e3e8eb3fde75f16c5cc2a52f68d19eb28cc05d2b3",
      "origin": "machine",
      "message": "实验室令牌不正确"
    },
    "auth.token_shape": {
      "sourceHash": "a8e3f364c7698efe1e6d6816ae47eab396873b8384182fe50390f7746b43763c",
      "origin": "machine",
      "message": "实验室令牌是仪表板“实验室令牌”磁贴上的6字符代码"
    }
  }
}
